{
  "schema_version": "flow.execution-subject-lock/v1",
  "canonicalization": "flow.canonical-json/v1",
  "subject_lock_id": "subject-lock:synthetic-process",
  "extension_lock_id": "lock:synthetic-suite",
  "extension": {
    "extension_id": "org.egohygiene.synthetic-adapters",
    "version": "0.1.0",
    "publisher_id": "org.egohygiene",
    "integrity": "1edb0efe95bec579fc3b7d70a9dbe97ef516782aaa6aacdabf69f3139758485c"
  },
  "capability_id": "optiflow/inspect-collection",
  "interface": {
    "kind": "process",
    "name": "synthetic-process",
    "protocol": "flow.extension-invocation/v1"
  },
  "declared_entrypoint": "flow-synthetic-adapter",
  "package": {
    "subject_id": "package:synthetic-adapters",
    "kind": "directory",
    "locator": "packages/synthetic adapter",
    "digest": {
      "algorithm": "sha256",
      "value": "1edb0efe95bec579fc3b7d70a9dbe97ef516782aaa6aacdabf69f3139758485c"
    }
  },
  "executable": {
    "subject_id": "executable:synthetic-adapter",
    "kind": "file",
    "locator": "flow synthetic adapter",
    "digest": {
      "algorithm": "sha256",
      "value": "2222222222222222222222222222222222222222222222222222222222222222"
    }
  },
  "evidence_policy": {
    "content_digest": "required",
    "lock_equality": "required",
    "cryptographic_verification": "not-required",
    "publisher_identity": "declaration-correlation",
    "operator_trust": "extension-lock",
    "transparency_log": "not-required"
  }
}
